{
  "version": "v0.1",
  "request_id": "mcp.req.fairway-dynasty.analytics.phase1.20260225",
  "service_id": "fairway-dynasty",
  "requested_at": "2026-02-25T00:00:00Z",
  "status": "requested",
  "request_type": "capability_expansion",
  "approval_tier": "medium",
  "risk_tier": "medium",
  "human_gate_required": true,
  "title": "Enable core analytics capabilities for deterministic operations-loop telemetry in Fairway Dynasty Phase 1",
  "owner": "platform-ops-owner",
  "objective": "Use existing core-analytics MCP capabilities to aggregate and summarize deterministic day-loop outcomes under mandatory governance.",
  "required_capabilities": [
    "aggregate_events",
    "compute_kpi_summary",
    "detect_anomaly"
  ],
  "constraints": [
    "No new MCP ID minting from service side.",
    "No runtime implementation in ai-governance repository.",
    "Capability scope must match central registry and service allowlist.",
    "Any payment/account boundary change escalates to high tier."
  ],
  "target_core_mcp_id": "core-analytics-mcp",
  "io_contract": {
    "ingest_subject": "daily_operations_loop",
    "required_fields": ["trace_id", "day", "seed", "ops_action", "verdict_hash", "day_report"],
    "determinism_requirement": "same input + same seed => same verdict_hash"
  },
  "evidence_refs": [
    {
      "path": "control/registry/mcps.v0.1.json",
      "sha256": "2d2ae5aef57f5ce13330715ae884ddcaca766a57e4f709ed7439fe5fa70b68dc"
    },
    {
      "path": "mcps/core-analytics-mcp/manifest.json",
      "sha256": "9a9ccd4bbdf5fad35f052ea5587637cbe223f816e573f7799cb3f12f243393c4"
    },
    {
      "path": "mcps/core-analytics-mcp/versions/runtime.binding.v0.1.json",
      "sha256": "dfeaeefde8de509bfa68f4fc7be536c1aa5cc7be719fda712e565010da968425"
    },
    {
      "path": "services/fairway-dynasty/mcp.allowlist.json",
      "sha256": "2bb81a7691ff9e6aaa24103cf6482add745a5ca78a65ca35a6191f6bb767db05"
    }
  ]
}
