{
  "version": "v0.1",
  "request_id": "mcp.req.tdp.quality.engineering.20260223",
  "service_id": "thedivineparadox",
  "title": "MCP request for Testing/Bug/Refactoring quality engineering cell",
  "requested_at": "2026-02-23T06:40:00Z",
  "approval_tier": "high",
  "human_gate_required": true,
  "owner": "architect-owner",
  "objective": "Establish a dedicated quality-engineering loop that continuously finds regressions, removes dead scripts/folders, and keeps service structure minimal while preserving deterministic governance guarantees.",
  "required_capabilities": [
    "quality.test_plan.generate",
    "quality.regression.detect",
    "quality.refactor.impact_analyze",
    "quality.repo.redundancy_scan",
    "bridge.intent.consume",
    "artifact.report.write"
  ],
  "constraints": [
    "No runtime governance-core logic expansion.",
    "All bug/refactor outputs must include evidence refs and rollback condition.",
    "No merge when deterministic snapshot or acceptance gates fail.",
    "No folder/script duplication without explicit owner approval.",
    "Production changes remain human-gated."
  ],
  "evidence_refs": [
    {
      "path": "reports/governance/strategy-council-tdp-v0.1.md",
      "sha256": "6b804b27a3adaa3ed21743ea6c8146505eeefaf74355a1d9685eebd9aaf695e7"
    },
    {
      "path": "control/playbooks/change-management.md",
      "sha256": "9775b1e05e0d70d202ec60c9c3d5e8261b9c30104705f175e658e2742abb9585"
    },
    {
      "path": "reports/governance/ui-ux-rubric-tdp-v0.1.md",
      "sha256": "7e3fd3c0729e4650166af7adfb595d5d14b8ffd84273051508cc67fb6836d7b2"
    }
  ],
  "status": "requested"
}
