{
  "version": "v0.1",
  "request_id": "mcp.req.tdp.analytics_learning_actions.20260225",
  "service_id": "thedivineparadox",
  "requested_at": "2026-02-25T00:00:00Z",
  "status": "approved",
  "request_type": "capability_expansion",
  "approval_tier": "medium",
  "risk_tier": "medium",
  "human_gate_required": true,
  "title": "Register propose_learning_actions in central analytics contract and align sidecar runtime binding",
  "owner": "system-architect-approved",
  "objective": "Resolve analytics capability drift by centrally registering propose_learning_actions and pinning sidecar runtime metadata.",
  "required_capabilities": [
    "aggregate_events",
    "compute_kpi_summary",
    "detect_anomaly",
    "propose_learning_actions"
  ],
  "constraints": [
    "Service runtime must use core namespace only.",
    "Capability drift between registry and allowlist is not allowed.",
    "Runtime binding hash must match manifest and registry pinned_ref_hash."
  ],
  "target_core_mcp_id": "core-analytics-mcp",
  "io_contract": {
    "invocation_surface": "POST /invoke (local HTTP sidecar)",
    "runtime_repo_path": "apps/mcp-runtime/src/runtime.ts"
  },
  "evidence_refs": [
    {
      "path": "mcps/core-analytics-mcp/versions/runtime.binding.v0.1.json",
      "sha256": "dfeaeefde8de509bfa68f4fc7be536c1aa5cc7be719fda712e565010da968425"
    },
    {
      "path": "mcps/core-analytics-mcp/manifest.json",
      "sha256": "9a9ccd4bbdf5fad35f052ea5587637cbe223f816e573f7799cb3f12f243393c4"
    },
    {
      "path": "control/registry/mcps.v0.1.json",
      "sha256": "2d2ae5aef57f5ce13330715ae884ddcaca766a57e4f709ed7439fe5fa70b68dc"
    },
    {
      "path": "services/thedivineparadox/mcp.allowlist.json",
      "sha256": "53f6c8e550786439354ba9ab28fb5c9ba82fc4293d7694c72223ae06bf650807"
    }
  ]
}
