{
  "version": "v0.1",
  "request_id": "mcp.req.council_under_siege.core_knowledge_vault_mcp_registration.20260225",
  "service_id": "council-under-siege",
  "requested_at": "2026-02-25T00:00:00Z",
  "status": "requested",
  "request_type": "new_mcp_registration",
  "approval_tier": "high",
  "risk_tier": "high",
  "human_gate_required": true,
  "title": "Register core knowledge vault MCP for deterministic read-only note retrieval",
  "owner": "platform-ops-owner",
  "objective": "Establish a governance-approved core MCP ID for read-only vault retrieval with deterministic output and strict boundary guards.",
  "constraints": [
    "No runtime implementation in ai-governance repository.",
    "Read-only contract for v0.1; write APIs are explicitly out of scope.",
    "Registry and allowlist remain unchanged until human approval."
  ],
  "mcp_candidate": {
    "id": "core-knowledge-vault-mcp",
    "name": "Core Knowledge Vault MCP",
    "proposed_root_path": "mcps/core-knowledge-vault-mcp",
    "capabilities": [
      "list_notes",
      "read_note",
      "search_notes",
      "get_metadata"
    ],
    "required_approval_tier": "high",
    "risk_level": "high"
  },
  "governance_rationale": {
    "need": "A centrally governed note-vault capability is required for deterministic evidence retrieval without service-specific MCP ID fragmentation.",
    "boundary": "Enforce read-only file access under configured vault root with no network side effects and no write operations.",
    "controls": [
      "human_gate_required=true for initial registration and subsequent boundary expansion",
      "deterministic ordering and fixed error envelope for all verdict-relevant responses",
      "path traversal guard and file size limits in runtime adapter"
    ]
  },
  "expected_artifacts": [
    "control/registry/mcps.v0.1.json",
    "mcps/core-knowledge-vault-mcp/manifest.json",
    "mcps/core-knowledge-vault-mcp/versions/runtime.binding.v0.1.json",
    "services/council-under-siege/mcp.allowlist.json"
  ],
  "evidence_refs": [
    {
      "path": "reports/governance/council-under-siege-monetization-asset-prompt-pack-v0.1.md",
      "sha256": "09926118c9ad047b458605a2f330937fe3e414984b201067cf771829ddb5bbf7"
    },
    {
      "path": "policies/mcp_ownership_policy.v0.1.md",
      "sha256": "dc8a66a8d4b2a33430fd6d86f0cf1dd3bc0bc24266ab56734a5ac5a0eec6d9e1"
    },
    {
      "path": "reports/governance/cus-asset-intake-checklist-v0.1.md",
      "sha256": "0f4223e278421acd449f94a61f7720fc9cf11bf1668ae28cbeb9e1d1d562c06f"
    }
  ]
}
