{
  "version": "v0.1",
  "request_id": "mcp.req.cus.safety_monetization.20260225",
  "service_id": "council-under-siege",
  "requested_at": "2026-02-25T00:00:00Z",
  "status": "requested",
  "request_type": "capability_expansion",
  "approval_tier": "high",
  "risk_tier": "high",
  "human_gate_required": true,
  "title": "Request monetization guardrail safety capabilities",
  "owner": "platform-ops-owner",
  "objective": "Detect dark-pattern monetization risks and emit governance guardrail notices before release.",
  "required_capabilities": [
    "detect_dark_pattern_risk",
    "emit_monetization_guardrail_notice"
  ],
  "constraints": [
    "High-risk monetization updates require explicit human architect approval.",
    "Asset provenance must exist for monetized visual signaling changes.",
    "No central registry/manifest/allowlist update before explicit approval."
  ],
  "target_core_mcp_id": "core-safety-fallback-mcp",
  "io_contract": {
    "invocation_surface": "POST /invoke (governed runtime adapter)",
    "runtime_repo_path": "external runtime repository"
  },
  "evidence_refs": [
    {
      "path": "reports/governance/cus-economy-simulation-spec-v0.1.md",
      "sha256": "b5e052355d204862a661cf8b16a29d3c7ab275e6753971bd85ae2b282da5b44b"
    },
    {
      "path": "reports/governance/cus-economy-sim-verdict-20260225.json",
      "sha256": "6c55a2fbb14c7cf25a07cfd9ee5d5695c002e0138c5bf3112b7dadcb953157f9"
    }
  ]
}
