{
  "version": "v0.1",
  "request_id": "mcp.req.council_under_siege.analytics_turn_consensus.20260225",
  "service_id": "council-under-siege",
  "requested_at": "2026-02-25T00:00:00Z",
  "status": "requested",
  "request_type": "capability_expansion",
  "approval_tier": "medium",
  "risk_tier": "medium",
  "human_gate_required": false,
  "title": "Request analytics capability expansion for one-turn agent consensus scoring",
  "owner": "platform-ops-owner",
  "objective": "Enable deterministic scoring and selection logic for multi-agent proposal consensus in Phase 1 governance loop.",
  "required_capabilities": [
    "score_agent_proposals",
    "select_consensus_action"
  ],
  "constraints": [
    "No runtime implementation in governance core repository.",
    "Verdict-critical path must remain deterministic.",
    "Registry/manifest/allowlist sync occurs only after approved status."
  ],
  "target_core_mcp_id": "core-analytics-mcp",
  "io_contract": {
    "invocation_surface": "POST /invoke (governed sidecar)",
    "runtime_repo_path": "external service runtime adapter"
  },
  "evidence_refs": [
    {
      "path": "tmp/council-under-siege.phase1.intent.local.json",
      "sha256": "610d44edcd191267c147d83f9cedf282a1398d6ed43c5e674d22bc0181ff9be3"
    },
    {
      "path": "control/registry/services.v0.1.json",
      "sha256": "e2b791ed3c599b2d8d820197c799dd76f35fa4d2411369fb302a4f6423c2dd29"
    },
    {
      "path": "mcps/core-analytics-mcp/manifest.json",
      "sha256": "9a9ccd4bbdf5fad35f052ea5587637cbe223f816e573f7799cb3f12f243393c4"
    }
  ]
}
