{
  "version": "v0.1",
  "request_id": "mcp.req.tdp.ops.stabilization.20260223",
  "service_id": "thedivineparadox",
  "title": "MCP request for Phase-2 ops stabilization and deployment verification",
  "requested_at": "2026-02-23T01:41:00Z",
  "approval_tier": "high",
  "human_gate_required": true,
  "owner": "architect-owner",
  "objective": "Stabilize Cloud Run staging/prod deployment verification with strict traceability while preserving deterministic verdict paths.",
  "required_capabilities": [
    "gcp.cloud_run.describe",
    "gcp.secret_manager.describe",
    "gcp.secret_manager.access_policy_check",
    "github.actions.run_read",
    "github.actions.run_rerun"
  ],
  "constraints": [
    "No runtime verdict logic change.",
    "No nondeterministic dependency on verdict path.",
    "All deployment checks must be trace-linked to run ids and commit refs.",
    "Production changes require explicit architect sign-off."
  ],
  "evidence_refs": [
    {
      "path": "traces/bridge/dispatched/tdp.phase2.ops_hardening.dispatch.json",
      "sha256": "f01acdbd9be9f38b82150fed7687e6671f3175da68341a125e0d899a502c7e6c"
    },
    {
      "path": "reports/governance/bridge-pm-mode-transition-20260222.md",
      "sha256": "5760944761b112a889762ffe1106ca16d358b9689e4c8fc1e3efddc55a27b0c4"
    }
  ],
  "status": "requested"
}
