{
  "version": "v0.1",
  "request_id": "mcp.req.fairway-dynasty.analytics.phase1.2d.20260225",
  "service_id": "fairway-dynasty",
  "requested_at": "2026-02-25T00:00:00Z",
  "status": "requested",
  "request_type": "capability_expansion",
  "approval_tier": "medium",
  "risk_tier": "medium",
  "human_gate_required": true,
  "title": "Align Fairway Dynasty 2D operations telemetry with central analytics MCP",
  "owner": "platform-ops-owner",
  "objective": "Track deterministic day-loop and idle-loop summaries under governance-safe analytics contract.",
  "required_capabilities": [
    "aggregate_events",
    "compute_kpi_summary",
    "detect_anomaly"
  ],
  "constraints": [
    "No service-side MCP ID minting.",
    "No registry/manifest/allowlist drift.",
    "No payment boundary expansion in this request.",
    "Deterministic verdict hash must be persisted with evidence refs."
  ],
  "target_core_mcp_id": "core-analytics-mcp",
  "io_contract": {
    "required_fields": [
      "trace_id",
      "day",
      "base_seed",
      "ops_action",
      "verdict_hash",
      "idle_hash",
      "economy_delta"
    ],
    "ruleset_version": "fd.sim.ruleset.v0.2"
  },
  "evidence_refs": [
    {
      "path": "control/registry/mcps.v0.1.json",
      "sha256": "2d2ae5aef57f5ce13330715ae884ddcaca766a57e4f709ed7439fe5fa70b68dc"
    },
    {
      "path": "mcps/core-analytics-mcp/manifest.json",
      "sha256": "9a9ccd4bbdf5fad35f052ea5587637cbe223f816e573f7799cb3f12f243393c4"
    },
    {
      "path": "mcps/core-analytics-mcp/versions/runtime.binding.v0.1.json",
      "sha256": "dfeaeefde8de509bfa68f4fc7be536c1aa5cc7be719fda712e565010da968425"
    },
    {
      "path": "services/fairway-dynasty/mcp.allowlist.json",
      "sha256": "2bb81a7691ff9e6aaa24103cf6482add745a5ca78a65ca35a6191f6bb767db05"
    }
  ]
}
