{
  "version": "v0.1",
  "request_id": "mcp.req.obsidian-mcp.multimodel-image-orchestrator.20260226",
  "service_id": "obsidian-mcp",
  "requested_at": "2026-02-26T18:45:00Z",
  "status": "proposed",
  "request_type": "new_mcp_registration",
  "approval_tier": "high",
  "risk_tier": "high",
  "human_gate_required": true,
  "owner": "platform-ops-owner",
  "mcp_candidate": {
    "id": "core-image-orchestrator-mcp",
    "name": "CoreImageOrchestratorMCP",
    "proposed_root_path": "mcps/core-image-orchestrator-mcp",
    "capabilities": [
      "image.route_profile",
      "image.compose_lora_stack",
      "image.generate_batch",
      "image.verify_policy"
    ],
    "required_approval_tier": "high",
    "risk_level": "high"
  },
  "governance_rationale": {
    "need": "Centralize multi-model image generation governance with deterministic evidence and policy-bound routing.",
    "boundary": "Runtime model orchestration stays outside ai-governance; core keeps contracts and verification only.",
    "controls": [
      "mandatory human gate for high-tier generation flows",
      "hash-pinned prompt/profile references",
      "artifact manifest integrity verification",
      "deterministic replay conformance checks"
    ]
  },
  "expected_artifacts": [
    "reports/governance/multimodel-image-governance-contract-v0.1.md",
    "mcps/core-image-orchestrator-mcp/manifest.json",
    "mcps/core-image-orchestrator-mcp/docs/MCP.md",
    "mcps/core-image-orchestrator-mcp/docs/CAPABILITIES.md",
    "mcps/core-image-orchestrator-mcp/docs/SECURITY.md",
    "mcps/core-image-orchestrator-mcp/versions/runtime.binding.v0.1.json"
  ]
}
